{
  "$schema": "https://5thelement.ai/schemas/signals.json",
  "version": "3.1",
  "generated": "2026-08-25",
  "service": "3webs",
  "total": 167,
  "result_states": [
    "PASS",
    "PARTIAL",
    "FAIL",
    "NOT_APPLICABLE",
    "UNVERIFIED"
  ],
  "maturity_classes": [
    "STANDARD",
    "PROVIDER_SPECIFIC",
    "ESTABLISHED_PRACTICE",
    "EMERGING",
    "3WEBS_METHOD",
    "EXPERIMENTAL"
  ],
  "web_layers": [
    "HUMAN_WEB",
    "AI_WEB",
    "MACHINE_WEB"
  ],
  "principles": {
    "evidence_required": true,
    "declaration_is_proof": false,
    "private_metrics_are_not_invented": true,
    "not_applicable_is_not_unverified": true,
    "capability_progression": [
      "DECLARED",
      "VALID",
      "REACHABLE",
      "INVOCABLE",
      "VERIFIED"
    ]
  },
  "discipline_counts": {
    "AEO": 34,
    "GEO": 28,
    "AIO": 31,
    "SEO": 42,
    "AI_SIGNALS": 32
  },
  "catalogue": {
    "AEO": [
      {
        "id": "aeo1",
        "name": "FAQ Structured Data",
        "category": "ON-PAGE",
        "weight": 9,
        "web_layers": [
          "HUMAN_WEB",
          "AI_WEB"
        ],
        "maturity": "ESTABLISHED_PRACTICE",
        "publicly_testable": true
      },
      {
        "id": "aeo2",
        "name": "HowTo Structured Data Where Applicable",
        "category": "ON-PAGE",
        "weight": 7,
        "web_layers": [
          "HUMAN_WEB",
          "AI_WEB"
        ],
        "maturity": "ESTABLISHED_PRACTICE",
        "publicly_testable": true
      },
      {
        "id": "aeo3",
        "name": "Question-and-Answer Content Blocks",
        "category": "ON-PAGE",
        "weight": 9,
        "web_layers": [
          "HUMAN_WEB",
          "AI_WEB"
        ],
        "maturity": "ESTABLISHED_PRACTICE",
        "publicly_testable": true
      },
      {
        "id": "aeo4",
        "name": "Extractable Direct Answer Blocks",
        "category": "ON-PAGE",
        "weight": 10,
        "web_layers": [
          "AI_WEB"
        ],
        "maturity": "3WEBS_METHOD",
        "publicly_testable": true
      },
      {
        "id": "aeo5",
        "name": "Speakable Structured Data Where Applicable",
        "category": "ON-PAGE",
        "weight": 5,
        "web_layers": [
          "AI_WEB"
        ],
        "maturity": "PROVIDER_SPECIFIC",
        "publicly_testable": true
      },
      {
        "id": "aeo6",
        "name": "Article Structured Data Where Applicable",
        "category": "ON-PAGE",
        "weight": 7,
        "web_layers": [
          "HUMAN_WEB",
          "AI_WEB"
        ],
        "maturity": "ESTABLISHED_PRACTICE",
        "publicly_testable": true
      },
      {
        "id": "aeo7",
        "name": "Breadcrumb Structured Data",
        "category": "ON-PAGE",
        "weight": 7,
        "web_layers": [
          "HUMAN_WEB",
          "AI_WEB"
        ],
        "maturity": "ESTABLISHED_PRACTICE",
        "publicly_testable": true
      },
      {
        "id": "aeo8",
        "name": "Table of Contents and Section Anchors",
        "category": "ON-PAGE",
        "weight": 6,
        "web_layers": [
          "HUMAN_WEB",
          "AI_WEB"
        ],
        "maturity": "ESTABLISHED_PRACTICE",
        "publicly_testable": true
      },
      {
        "id": "aeo9",
        "name": "External Entity Disambiguation",
        "category": "OFF-PAGE",
        "weight": 8,
        "web_layers": [
          "AI_WEB"
        ],
        "maturity": "ESTABLISHED_PRACTICE",
        "publicly_testable": true
      },
      {
        "id": "aeo10",
        "name": "Search Knowledge Entity Presence",
        "category": "OFF-PAGE",
        "weight": 9,
        "web_layers": [
          "AI_WEB"
        ],
        "maturity": "PROVIDER_SPECIFIC",
        "publicly_testable": true
      },
      {
        "id": "aeo11",
        "name": "Direct Answer Formatting",
        "category": "ON-PAGE",
        "weight": 9,
        "web_layers": [
          "HUMAN_WEB",
          "AI_WEB"
        ],
        "maturity": "ESTABLISHED_PRACTICE",
        "publicly_testable": true
      },
      {
        "id": "aeo12",
        "name": "Intent-Oriented URL Structure",
        "category": "ON-SITE",
        "weight": 6,
        "web_layers": [
          "HUMAN_WEB",
          "AI_WEB"
        ],
        "maturity": "ESTABLISHED_PRACTICE",
        "publicly_testable": true
      },
      {
        "id": "aeo13",
        "name": "People-Also-Ask Topic Coverage",
        "category": "OFF-PAGE",
        "weight": 7,
        "web_layers": [
          "AI_WEB"
        ],
        "maturity": "PROVIDER_SPECIFIC",
        "publicly_testable": true
      },
      {
        "id": "aeo14",
        "name": "Featured Answer Extractability",
        "category": "ON-PAGE",
        "weight": 9,
        "web_layers": [
          "AI_WEB"
        ],
        "maturity": "ESTABLISHED_PRACTICE",
        "publicly_testable": true
      },
      {
        "id": "aeo15",
        "name": "Definition Blocks",
        "category": "ON-PAGE",
        "weight": 7,
        "web_layers": [
          "HUMAN_WEB",
          "AI_WEB"
        ],
        "maturity": "ESTABLISHED_PRACTICE",
        "publicly_testable": true
      },
      {
        "id": "aeo16",
        "name": "Step-by-Step Content Structure",
        "category": "ON-PAGE",
        "weight": 7,
        "web_layers": [
          "HUMAN_WEB",
          "AI_WEB"
        ],
        "maturity": "ESTABLISHED_PRACTICE",
        "publicly_testable": true
      },
      {
        "id": "aeo17",
        "name": "Concise Lead Answer",
        "category": "ON-PAGE",
        "weight": 7,
        "web_layers": [
          "AI_WEB"
        ],
        "maturity": "3WEBS_METHOD",
        "publicly_testable": true
      },
      {
        "id": "aeo18",
        "name": "Natural-Language Query Coverage",
        "category": "ON-PAGE",
        "weight": 7,
        "web_layers": [
          "AI_WEB"
        ],
        "maturity": "3WEBS_METHOD",
        "publicly_testable": true
      },
      {
        "id": "aeo19",
        "name": "Answer-First Content Structure",
        "category": "ON-PAGE",
        "weight": 9,
        "web_layers": [
          "AI_WEB"
        ],
        "maturity": "3WEBS_METHOD",
        "publicly_testable": true
      },
      {
        "id": "aeo20",
        "name": "Semantically Descriptive Headings",
        "category": "ON-PAGE",
        "weight": 8,
        "web_layers": [
          "HUMAN_WEB",
          "AI_WEB"
        ],
        "maturity": "ESTABLISHED_PRACTICE",
        "publicly_testable": true
      },
      {
        "id": "aeo21",
        "name": "Conversational Query Coverage",
        "category": "ON-PAGE",
        "weight": 8,
        "web_layers": [
          "AI_WEB"
        ],
        "maturity": "3WEBS_METHOD",
        "publicly_testable": true
      },
      {
        "id": "aeo22",
        "name": "Structured Data Relationship Coherence",
        "category": "ON-PAGE",
        "weight": 7,
        "web_layers": [
          "AI_WEB"
        ],
        "maturity": "ESTABLISHED_PRACTICE",
        "publicly_testable": true
      },
      {
        "id": "aeo23",
        "name": "Rich Result Eligibility",
        "category": "ON-PAGE",
        "weight": 8,
        "web_layers": [
          "HUMAN_WEB",
          "AI_WEB"
        ],
        "maturity": "PROVIDER_SPECIFIC",
        "publicly_testable": true
      },
      {
        "id": "aeo24",
        "name": "Google AI Overview and AI Mode Source Readiness",
        "category": "ON-PAGE",
        "weight": 9,
        "web_layers": [
          "AI_WEB"
        ],
        "maturity": "PROVIDER_SPECIFIC",
        "publicly_testable": true
      },
      {
        "id": "aeo25",
        "name": "Context Continuity Across Sections",
        "category": "ON-PAGE",
        "weight": 7,
        "web_layers": [
          "AI_WEB"
        ],
        "maturity": "3WEBS_METHOD",
        "publicly_testable": true
      },
      {
        "id": "aeo26",
        "name": "Primary Entity Salience",
        "category": "ON-PAGE",
        "weight": 8,
        "web_layers": [
          "AI_WEB"
        ],
        "maturity": "3WEBS_METHOD",
        "publicly_testable": true
      },
      {
        "id": "aeo27",
        "name": "Semantic HTML Structure",
        "category": "ON-SITE",
        "weight": 8,
        "web_layers": [
          "HUMAN_WEB",
          "AI_WEB"
        ],
        "maturity": "STANDARD",
        "publicly_testable": true
      },
      {
        "id": "aeo28",
        "name": "ClaimReview Structured Data Where Applicable",
        "category": "ON-PAGE",
        "weight": 5,
        "web_layers": [
          "AI_WEB"
        ],
        "maturity": "ESTABLISHED_PRACTICE",
        "publicly_testable": true
      },
      {
        "id": "aeo29",
        "name": "Event Structured Data Where Applicable",
        "category": "ON-PAGE",
        "weight": 5,
        "web_layers": [
          "HUMAN_WEB",
          "AI_WEB"
        ],
        "maturity": "ESTABLISHED_PRACTICE",
        "publicly_testable": true
      },
      {
        "id": "aeo30",
        "name": "Product Structured Data Where Applicable",
        "category": "ON-PAGE",
        "weight": 7,
        "web_layers": [
          "HUMAN_WEB",
          "AI_WEB"
        ],
        "maturity": "ESTABLISHED_PRACTICE",
        "publicly_testable": true
      },
      {
        "id": "aeo31",
        "name": "LocalBusiness Structured Data Where Applicable",
        "category": "ON-PAGE",
        "weight": 6,
        "web_layers": [
          "HUMAN_WEB",
          "AI_WEB"
        ],
        "maturity": "ESTABLISHED_PRACTICE",
        "publicly_testable": true
      },
      {
        "id": "aeo32",
        "name": "Review and Rating Structured Data Validity",
        "category": "ON-PAGE",
        "weight": 6,
        "web_layers": [
          "HUMAN_WEB",
          "AI_WEB"
        ],